{
    "slow_ch": [2],
    "fast_ch": [3],
    "bias_v": 0,
    "plunger_v": 0,
    "acc_v": 0,
    "vb1_v": 0,
    "vb2_v": 0,
    "slow_vstart": 0,
    "slow_vend": -1.805,
    "slow_steps": 2,
    "slow_step_size": 2.05,
    "fast_vstart": 0,
    "fast_vend": -0.5,
    "fast_steps": 41,
    "fast_step_size": 0.05,
    "fast_ch_name": "Vx",
    "slow_ch_name": "Vy"
}